{
  "kind": "atomlearn.strategy-experiment",
  "schema_version": 1,
  "revision": 1,
  "id": "exp-example-first-001",
  "scope": "user",
  "dimension": "explanation.order",
  "baseline": "intuition_first",
  "candidate": "example_first",
  "hypothesis": "Starting with a concrete example improves transfer without increasing failure.",
  "evidence_refs": ["ev-000001", "evt-000002"],
  "contexts": ["teaching"],
  "status": "monitoring",
  "shadow_mode": true,
  "strata": {
    "atom_types": ["concept", "procedure"],
    "episode_types": ["new_learning"]
  },
  "metrics": {
    "primary": ["first_transfer_score", "delayed_review_score"],
    "guardrails": ["misconception_recurrence", "blocking_backtrack_rate"]
  },
  "minimums": {
    "distinct_atoms": 5,
    "delayed_outcomes": 2
  },
  "thresholds": {
    "minimum_quality_delta": 0.02,
    "maximum_quality_degradation": 0.02,
    "maximum_guardrail_delta": 0.05
  }
}
